Number,Reference,verse_text (KJV),Themes,Quick Reflection,Extended Reflection,Alignment ,Prayer
537,Psalm Chapter 103,"Bless the LORD, O my soul: and all that is within me, bless his holy name. Bless the LORD, O my soul, and forget not all his benefits: Who forgiveth all thine iniquities; who healeth all thy diseases; Who redeemeth thy life from destruction; who crowneth thee with lovingkindness and tender mercies;
Who satisfieth thy mouth with good things; so that thy youth is renewed like the eagle’s. The LORD executeth righteousness and judgment for all that are oppressed.
He made known his ways unto Moses, his acts unto the children of Israel. The LORD is merciful and gracious, slow to anger, and plenteous in mercy. He will not always chide: neither will he keep his anger for ever. He hath not dealt with us after our sins; nor rewarded us according to our iniquities. For as the heaven is high above the earth, so great is his mercy toward them that fear him. As far as the east is from the west, so far hath he removed our transgressions from us. Like as a father pitieth
his children, so the LORD pitieth them that fear him. For he knoweth our frame; he remembereth that we are dust. As for man, his days are as grass: as a flower of the field, so he flourisheth. For the wind passeth over it, and it is gone; and the place thereof shall know it no more. But the mercy of the LORD is from everlasting to everlasting upon them that fear him, and his righteousness unto children’s children; To such as keep his covenant, and to those that remember his commandments to do them. The LORD hath prepared his throne in the heavens; and his kingdom ruleth over all. Bless the LORD, ye his angels, that excel in strength, that do his commandments, hearkening unto the voice of his word. Bless ye the LORD, all ye his hosts; ye ministers of his, that do his pleasure. Bless the LORD, all his works in all places of his dominion: bless the LORD, O my soul.","Forgiveness, Mercy, Compassion, Praise","A hymn of thanksgiving, rejoicing in God’s mercy, forgiveness, and steadfast love.","This psalm is a soaring hymn of gratitude for God’s mercy. David recounts God’s blessings: forgiveness, healing, redemption, and love that satisfies and renews like youth restored. He marvels at God’s compassion, slow to anger and abounding in love, removing sins “as far as the east is from the west.” The psalm also acknowledges human frailty—we are dust, our days are fleeting—but God’s steadfast love endures forever for those who fear Him. His throne is established in heaven, and His kingdom rules over all. It reminds me that no matter my failures or weakness, God’s mercy is greater, His love unending, and His reign secure.","This encourages me to continually remember God’s benefits and not take His mercy for granted. It calls me to live with gratitude, humility, and awe at His compassion.","Dear Heavenly Father, thank You for forgiving my sins and crowning my life with love and compassion. Teach me to bless Your name with all that I am, and never forget Your benefits. In Jesus’ name, Amen."
538,Psalm 104:11,They give drink to every beast of the field: the wild asses quench their thirst.,"Provision, Creation, Care, Abundance",Highlights God’s provision that sustains all living creatures.,"This verse reflects God’s care for creation, providing water even for the wild animals. His provision reaches beyond humanity to every living thing, showing His abundant care. It reminds me that if God provides for the creatures of the field, He surely provides for me as His child.",This encourages me to trust God’s daily provision and to see His hand in the natural world around me.,"Dear Heavenly Father, thank You for caring for all creation. Help me to trust Your provision in my life and to see Your care in every detail. In Jesus’ name, Amen."
539,Psalm 105:7,He is the LORD our God: his judgments are in all the earth.,"Covenant, Sovereignty, Faithfulness, Identity",Affirms God’s covenant faithfulness and His rule over the earth.,"This verse proclaims God as both personal (“our God”) and universal (“His judgments are in all the earth”). It reminds me that the covenant-keeping God of Israel is also the sovereign ruler of the nations. His authority is not limited, and His faithfulness is sure.","This calls me to walk in confidence that my God rules over all, not just in my life but across the whole earth.","Dear Heavenly Father, thank You for being my God and the Lord of all creation. Help me to trust Your sovereign judgments and walk faithfully in Your covenant love. In Jesus’ name, Amen."
540,Psalm 105:43,"And he brought forth his people with joy, and his chosen with gladness:","Deliverance, Joy, Promise, Fulfillment",Celebrates God’s deliverance of His people with joy and freedom.,"This verse recalls the exodus, when God fulfilled His promise and delivered His people from slavery. Their freedom was marked by joy and celebration. It reminds me that God’s deliverance always brings joy, and His promises never fail.","This encourages me to rejoice in God’s deliverance in my own life, remembering that He brings me out of bondage into freedom.","Dear Heavenly Father, thank You for delivering me and filling my heart with joy. Teach me to celebrate Your promises fulfilled in my life. In Jesus’ name, Amen."
541,Psalm 106:28,"They joined themselves also unto Baal-peor, and ate the sacrifices of the dead.","Idolatry, Rebellion, Consequence, Warning",Warns against idolatry that betrays God’s covenant relationship.,This verse recalls Israel’s rebellion when they turned to idolatry and joined in pagan practices. It warns of the danger of aligning with what is lifeless and false. It reminds me that idolatry is not just ancient history but a present temptation—anything I give my devotion to over God becomes an idol.,"This calls me to keep my heart pure, devoted only to the living God, and to resist the pull of false worship in any form.","Dear Heavenly Father, protect me from idolatry and compromise. Keep my devotion fixed on You, the only true and living God. In Jesus’ name, Amen."
542,Psalm 107:7,"And he led them forth by the right way, that they might go to a city of habitation.","Guidance, Direction, Provision, Faithfulness",Describes God’s faithful guidance leading His people to safety and rest.,"This verse recalls God’s faithfulness in guiding His people through the wilderness into a place of safety and rest. It reminds me that God not only rescues but also directs, leading me along paths that bring life. His guidance is purposeful, taking me from wandering to belonging.","This encourages me to trust God’s leading, knowing He guides me toward places of rest and security.","Dear Heavenly Father, thank You for leading me on the right path. Help me to trust Your direction and walk faithfully where You guide. In Jesus’ name, Amen."
543,Psalm 107:40,"He poureth contempt upon princes, and causeth them to wander in the wilderness, where there is no way.","Humbling, Sovereignty, Justice, Dependence",Reveals God’s power to humble the proud and reduce them to nothing.,"This verse reveals God’s sovereignty in humbling the proud and powerful. Even nobles are subject to His will, and when they exalt themselves, He brings them low. It reminds me that God resists the proud but gives grace to the humble, and no position of power is secure without Him.","This calls me to walk in humility, remembering that God alone establishes or humbles.","Dear Heavenly Father, keep me from pride and self-reliance. Teach me to walk humbly and depend fully on You. In Jesus’ name, Amen."
544,Psalm 109:16,"Because that he remembered not to shew mercy, but persecuted the poor and needy man, that he might even slay the broken in heart.","Cruelty, Judgment, Compassion, Warning",Condemns cruelty toward the needy and shows God’s concern for the vulnerable.,"This verse describes the cruelty of the wicked who target the vulnerable instead of showing mercy. It reminds me that God sees how people treat the weak, and judgment falls on those who oppress rather than protect. Compassion is not optional—it reflects God’s heart.","This encourages me to remember the poor and brokenhearted, treating them with kindness and love.","Dear Heavenly Father, give me a heart of compassion. Keep me from hardness and teach me to reflect Your mercy toward the needy and hurting. In Jesus’ name, Amen."
545,Psalm 111:3,His work is honourable and glorious: and his righteousness endureth for ever.,"Majesty, Righteousness, Permanence, Praise",Proclaims the majesty and permanence of God’s works and righteousness.,"This verse exalts the beauty and permanence of God’s works. Unlike human efforts that fade, God’s deeds are majestic and His righteousness eternal. It reminds me that every act of God reflects His glory and stands as a testimony to His faithfulness.",This calls me to stand in awe of God’s majesty and to anchor my trust in His unchanging righteousness.,"Dear Heavenly Father, open my eyes to see the splendor of Your works. Let my heart rest in the assurance that Your righteousness endures forever. In Jesus’ name, Amen."
546,Psalm 114:3,"The sea saw it, and fled: Jordan was driven back.","Power, Deliverance, Creation, Presence",Remembers God’s miraculous power in creation moving to deliver His people.,"This verse poetically recalls God’s mighty acts—the Red Sea parting and the Jordan River standing still. Creation itself responded to His presence, making way for His people. It reminds me that nothing in creation can resist the will of God, and He is able to remove every barrier before His children.","This calls me to trust God to part the obstacles in my life, knowing His power makes a way where there is none.","Dear Heavenly Father, thank You for being the God who makes a way. Remove the barriers before me and lead me forward by Your mighty hand. In Jesus’ name, Amen."
547,Psalm 116:15,Precious in the sight of the LORD is the death of his saints.,"Value, Death, Preciousness, Eternal Care",Affirms the value God places on the lives and deaths of His faithful ones.,"This verse reminds me that God treasures the lives of His people, even in death. Their passing is not meaningless but precious to Him. It assures me that death is not defeat for the faithful, but entry into His eternal presence.","This comforts me to trust God with both life and death, knowing I am always precious in His sight.","Dear Heavenly Father, thank You for cherishing the lives of Your people. Help me to live faithfully and rest in the hope of eternal life with You. In Jesus’ name, Amen."
548,Psalm 118:29,O give thanks unto the LORD; for he is good: for his mercy endureth for ever.,"Thanksgiving, Love, Faithfulness, Worship",A call to give thanks rooted in God’s unchanging love and goodness.,"This refrain is a cornerstone of worship, declaring God’s goodness and steadfast love. It reminds me that gratitude is rooted not in circumstances but in God’s eternal character. His love is unchanging, and His goodness is constant.","This calls me to cultivate thanksgiving daily, remembering that God’s love endures beyond every season.","Dear Heavenly Father, thank You for Your unending love and goodness. Fill my heart with gratitude and let my life overflow with thanksgiving. In Jesus’ name, Amen."
549,Psalm 119:36,"Incline my heart unto thy testimonies, and not to covetousness.","Desire, Devotion, Obedience, Purity",A prayer to desire God’s Word above greed or worldly gain.,"This verse is a prayer for God to direct the heart toward His Word rather than greed or corruption. It reminds me that true devotion requires not only avoiding sin but actively desiring God’s commands. The pull of the world is strong, but God’s Word anchors my heart.",This encourages me to pray for a heart that longs for God’s truth more than worldly gain.,"Dear Heavenly Father, turn my heart toward Your Word. Guard me from greed and keep me devoted fully to Your truth. In Jesus’ name, Amen."
550,Psalm 119:74,They that fear thee will be glad when they see me; because I have hoped in thy word.,"Hope, Encouragement, Fellowship, God’s Word",Shows how personal hope in God’s Word encourages others in their faith.,"This verse shows how personal faith encourages others. When others see the psalmist’s hope in God’s Word, their own faith is strengthened. It reminds me that trusting God is not only personal but also a testimony that inspires the community of believers.","This encourages me to live in a way that builds up others, letting my hope in God’s Word shine as a source of encouragement.","Dear Heavenly Father, let my hope in Your Word strengthen those around me. Use my faith as a testimony that points others to You. In Jesus’ name, Amen."
551,Psalm 119:109,My soul is continually in my hand: yet do I not forget thy law.,"Vulnerability, Devotion, Commitment, Trust",Declares faithfulness to God’s instruction even in the face of danger.,"This verse highlights devotion under pressure. Even in danger, the psalmist clung to God’s Word as his anchor. It reminds me that obedience isn’t dependent on ease or safety—it’s a commitment that stands firm even in trials.",This calls me to remain faithful to God’s Word no matter the risks or challenges I face.,"Dear Heavenly Father, strengthen me to hold firmly to Your Word even when life feels fragile. Keep my heart faithful and courageous in every trial. In Jesus’ name, Amen."
552,Psalm 119:146,"I cried unto thee; save me, and I shall keep thy testimonies.","Cry for Help, Obedience, Urgency, Dependence",An urgent cry for God’s salvation paired with a resolve to obey Him.,This verse captures urgency in prayer. The psalmist cried out for salvation with the resolve to obey God’s Word. It reminds me that dependence on God goes hand in hand with a commitment to live according to His commands.,This encourages me to call on God in urgent times with a heart ready to obey His Word.,"Dear Heavenly Father, hear my cry and save me. Give me strength to walk in obedience as I depend fully on You. In Jesus’ name, Amen."
553,Psalm chapter 121,"I will lift up mine eyes unto the hills, from whence cometh my help. My help cometh from the LORD, which made heaven and earth. He will not suffer thy foot to be moved: he that keepeth thee will not slumber. Behold, he that keepeth Israel shall neither slumber nor sleep. The LORD is thy keeper: the LORD is thy shade upon thy right hand. The sun shall not smite thee by day, nor the moon by night. The LORD shall preserve thee from all evil: he shall preserve thy soul. The LORD shall preserve thy going out and thy coming in from this time forth, and even for evermore.","Help, Protection, Watchfulness, Assurance",A psalm of trust in God’s vigilant protection over every step.,"This psalm is a song of confidence in God’s protection. The psalmist lifts his eyes, not to the hills for help, but beyond them to the Creator of heaven and earth. God is the vigilant keeper of His people—He does not slumber or sleep, and He guards every step, day and night. The promise is not of a life without trouble but of a God who keeps, shields, and preserves through every circumstance. It reminds me that my help is not in my own strength or the strength of others, but in the One who watches over me without fail.","This encourages me to lift my eyes to God whenever I feel vulnerable, trusting His constant care to guide and protect me through life’s journey.","Dear Heavenly Father, thank You for being my help and my keeper. Watch over my life and my steps, now and forevermore. Teach me to rest in the assurance of Your protection. In Jesus’ name, Amen."
554,Psalm 125:3,For the rod of the wicked shall not rest upon the lot of the righteous; lest the righteous put forth their hands unto iniquity.,"Justice, Protection, Guidance, Integrity",Assures that evil will not rule over the righteous forever.,"This verse assures that wickedness will not permanently rule over God’s people. God protects the righteous so that they are not overwhelmed or tempted into corruption. It reminds me that while evil may seem to prevail for a season, God’s justice is sure, and His people are preserved.","This encourages me to trust God’s protection and to remain steadfast in righteousness, even when surrounded by evil influences.","Dear Heavenly Father, protect me from the rule of wickedness and keep my hands from wrongdoing. Guard my heart and strengthen my steps in righteousness. In Jesus’ name, Amen."
555,Psalm 129:6,"Let them be as the grass upon the housetops, which withereth afore it groweth up:","Futility of Evil, Vindication, God’s Justice",Portrays the enemies of God’s people as weak and short-lived.,"This verse pictures the enemies of God’s people as weak and temporary, like grass on a rooftop that cannot thrive. It reminds me that opposition against God’s purposes has no lasting power—it withers quickly under His judgment.","This calls me to trust God’s vindication and not fear the seeming strength of the wicked, knowing their end is fleeting.","Dear Heavenly Father, remind me that evil has no lasting root. Strengthen my trust in Your justice and let me flourish in Your presence. In Jesus’ name, Amen."
556,Psalm 132:18,His enemies will I clothe with shame: but upon himself shall his crown flourish.,"Victory, Shame of Enemies, Glory of God’s Anointed",Promises shame for God’s enemies but glory for His anointed.,"This verse promises God’s favor for His anointed one. Enemies will be covered in shame while the king’s crown shines with glory. It reminds me that God vindicates His chosen and exalts those who walk in His favor. Ultimately, this points to Christ, crowned with glory, whose enemies are defeated.","This encourages me to trust in Christ’s victory and to walk with confidence in His reign, knowing shame is the destiny of His enemies, but glory rests on Him and His people.","Dear Heavenly Father, thank You for clothing the enemies of Your kingdom with shame and crowning Christ with glory. Help me to live in the assurance of His victory. In Jesus’ name, Amen."
557,Psalm chapter 136,"O give thanks unto the LORD; for he is good: for his mercy endureth for ever. O give thanks unto the God of gods: for his mercy endureth for ever. O give thanks to the Lord of lords: for his mercy endureth  for ever. To him who alone doeth great wonders: for his mercy endureth for ever. To him that by wisdom made the heavens: for his mercy endureth for ever. To him that stretched out the earth above the waters: for his mercyendureth for ever.To him that made great lights: for his mercy endureth for ever: The sun to rule by day: for his mercy endureth for ever: The moon and stars to rule by night: for his mercy endureth  for ever. To him that smote Egypt in their firstborn: for his mercy endureth for ever: And brought out Israel from among them: for his mercy endureth  for ever: With a strong hand, and with a stretched out arm: for his mercy endureth for ever. To him which divided the Red sea into parts: for his mercy endureth for ever: And made Israel to pass through the midst of it: for his mercy endureth for ever: But overthrew Pharaoh and his host in the Red sea: for his mercy endureth for ever. To him which led his people through the wilderness: for his mercy endureth for ever. To him which smote great kings: for his mercy endureth for ever: And slew famous kings: for his mercy endureth for ever: Sihon king of the Amorites: for his mercy endureth for ever: And Og the king of Bashan: for his mercy endureth for ever: And gave their land for an heritage: for his mercy endureth for ever: Even an heritage unto Israel his servant: for his mercy endureth for ever. Who remembered us in our low estate: for his mercy endureth for ever: And hath redeemed us from our enemies: for his mercy endureth  for ever. Who giveth food to all flesh: for his mercy endureth for ever. O give thanks unto the God of heaven: for his mercy endureth for ever.","Steadfast Love, Creation, Deliverance, Worship",Recounts God’s mighty acts with the refrain that His love endures forever.,"Psalm 136 is a call-and-response song, rehearsing God’s mighty acts and pairing each with the declaration that His steadfast love endures forever. From creating the heavens and earth, to striking down mighty kings, to rescuing His people from Egypt and leading them to their inheritance, the psalm affirms that God’s love is the foundation of every act. It reminds me that history itself is a testimony to God’s enduring mercy—His love is not fickle or temporary but eternal and unfailing. Even in times of struggle, remembering what God has done gives me confidence in what He will do.","This encourages me to continually give thanks, anchoring my life in the truth that God’s love is constant and enduring. His mercy is not only for the past but for today and forever.","Dear Heavenly Father, thank You for Your steadfast love that never ends. Help me to remember Your works of creation, deliverance, and kindness, and let my heart overflow with thanksgiving. In Jesus’ name, Amen."
558,Psalm 138:4,"All the kings of the earth shall praise thee, O LORD, when they hear the words of thy mouth.","Praise, Nations, Authority, Testimony",Envisions the day when rulers everywhere will acknowledge God’s promises.,This verse looks forward to a time when rulers across the earth will acknowledge God’s greatness. His promises are not limited to one people but are powerful enough to stir global praise. It reminds me that God’s Word has authority over every nation and that one day every knee will bow before Him.,"This encourages me to live as a witness to God’s promises, knowing they speak to all people, great and small.","Dear Heavenly Father, let the nations hear Your Word and give thanks. Use my life as a testimony of Your promises to draw others to praise You. In Jesus’ name, Amen."
559,Psalm 139:23,"Search me, O God, and know my heart: try me, and know my thoughts:","Examination, Purity, Guidance, Vulnerability",A vulnerable prayer inviting God to search the heart and refine it.,"This verse is a bold prayer of vulnerability, asking God to expose what lies within. Rather than hiding, the psalmist invites God to search, refine, and guide. It reminds me that God already knows my heart, but offering it to Him opens me to transformation and growth.","This calls me to live with openness before God, welcoming His correction and guidance so my life reflects His ways.","Dear Heavenly Father, search my heart and remove what does not honor You. Lead me in Your truth and guide me into the way everlasting. In Jesus’ name, Amen."
600,Ecclesiastes 5:8,"If thou seest the oppression of the poor, and violent perverting of judgment and justice in a province, marvel not at the matter: for he that is higher than the highest regardeth; and there be higher than they.","Oppression, Justice, Authority, Perspective",This verse observes the corruption of power and the layers of authority that allow injustice to persist.,"The writer notes that when the poor are oppressed and justice is denied, it should not surprise us—corruption exists in a fallen world, and even rulers answer to higher authorities. Ultimately, only God is perfectly just, and He sees all that is done. It reminds me not to be disillusioned by earthly systems but to trust in God’s oversight above them all.","This calls me to look beyond human authority and place my trust in God’s justice, which is sure and final.","Dear Heavenly Father, help me not to lose heart when I see injustice in the world. Remind me that You are the final Judge who sees and rules over all. In Jesus’ name, Amen."
601,Ecclesiastes 7:8,Better is the end of a thing than the beginning thereof: and the patient in spirit is better than the proud in spirit.,"Patience, Humility, Character, Wisdom","The writer contrasts beginnings with endings, showing that patience and humility lead to better outcomes than pride and haste.",This verse points to the value of patience and perseverance. Endings shaped by wisdom and humility carry greater weight than impulsive beginnings driven by pride. It reminds me that character is tested not at the start but at the finish. God honors endurance and a humble spirit.,"This encourages me to walk in patience, trusting God’s timing rather than rushing ahead in pride.","Dear Heavenly Father, teach me to be patient and humble. Help me finish well in the tasks and seasons You place before me. In Jesus’ name, Amen."
602,Ecclesiastes 8:11,"Because sentence against an evil work is not executed speedily, therefore the heart of the sons of men is fully set in them to do evil.","Justice, Consequence, Human Nature, Discipline","When judgment for wrongdoing is delayed, people become emboldened to continue in sin.","This verse reveals the danger of delayed justice: hearts grow hardened when consequences are not immediate. It reminds me that God’s patience should lead to repentance, not rebellion. While sin may appear unpunished for a time, God’s justice will not fail.","This calls me to live with reverence, not presuming on God’s patience, but choosing repentance and obedience.","Dear Heavenly Father, keep me from taking Your patience for granted. Help me to turn quickly from sin and to walk in obedience to Your Word. In Jesus’ name, Amen."
