Number,Reference,verse_text (KJV),Themes,Quick Reflection,Extended Reflection,Alignment ,Prayer
856,Book of Zechariah,Book of Zechariah,"Restoration, Encouragement, Messianic Hope, God’s Sovereignty","Zechariah’s visions encourage the returned exiles to rebuild the temple and look forward to the coming Messiah, who will bring ultimate restoration and reign as King.","Zechariah prophesied alongside Haggai to encourage God’s people after the exile. His message blends immediate encouragement—God’s presence in rebuilding the temple—with future Messianic hope. Through vivid visions, Zechariah reveals God’s sovereignty over nations, His plan to cleanse His people, and His promise of a coming King who will be both priest and ruler. The book looks forward to Christ, the humble King who comes riding on a donkey (Zechariah 9:9), and ultimately to His reign over all nations. For me, Zechariah blends present encouragement with eternal hope, reminding me that God’s plans are far bigger than my moment.",This book calls me to trust God’s promises of restoration and to live with hope in Christ’s return and reign.,"Dear Heavenly Father, thank You for Your promises that bring both present encouragement and eternal hope. Help me to walk faithfully today while keeping my eyes on Christ, the coming King. In Jesus’ name, Amen."
857,Zechariah 2:5,"For I, saith the LORD, will be unto her a wall of fire round about, and will be the glory in the midst of her.","Protection, Presence, Glory",God Himself will be a wall of fire around His people and the glory within them.,"This verse is a promise of both protection and presence. Instead of physical walls, God Himself would surround Jerusalem, defending His people with fire and filling them with His glory. It reminds me that God’s presence is both my shield and my strength.",This encourages me to trust God as my ultimate protector and to seek His presence as the true source of glory.,"Dear Heavenly Father, thank You for being my wall of fire and my glory. Surround me with Your protection and fill me with Your presence. In Jesus’ name, Amen."
858,Zechariah 4:13,"And he answered me and said, Knowest thou not what these be? And I said, No, my lord.","Vision, Explanation, God’s Work","The angel clarified the meaning of the vision to Zechariah, pointing to God’s purposes.","This verse reminds me that God provides interpretation and understanding for His visions and Word. Zechariah didn’t fully grasp what he saw, but the angel guided him into clarity. It shows that God doesn’t leave His people in confusion—He gives wisdom in His timing.","This calls me to seek understanding from God, trusting His Spirit to give clarity when I don’t understand His ways.","Dear Heavenly Father, thank You that You bring clarity and understanding to Your Word. Help me to listen to Your Spirit and walk in the truth You reveal. In Jesus’ name, Amen."
859,Zechariah 7:4,"Then came the word of the LORD of hosts unto me, saying,","True Worship, God’s Word, Correction","The Word of the Lord came, challenging empty rituals and calling for genuine devotion.","This verse sets the stage for God’s rebuke of empty fasting. The people practiced rituals, but their hearts were far from Him. It reminds me that God is not interested in outward forms of religion but in true devotion expressed in justice, mercy, and obedience.","This challenges me to examine my worship, ensuring it flows from sincerity and obedience rather than mere ritual.","Dear Heavenly Father, keep my worship sincere and my heart aligned with You. Teach me to honor You in truth and not with empty ritual. In Jesus’ name, Amen."
900,Matthew 28:3,"His countenance was like lightning, and his raiment white as snow:","Resurrection, Glory, Power","The angel at the tomb appeared radiant like lightning, a sign of God’s glory.","This verse describes the angel at Jesus’ resurrection: his appearance was dazzling, his clothes white as snow. It emphasizes the glory and authority of the heavenly messenger announcing the risen Christ. It reminds me that the resurrection is not only about victory over death but also about the majesty of God breaking into history.","This calls me to stand in awe of the resurrection, remembering that Christ’s victory shines with heaven’s glory and power.","Dear Heavenly Father, thank You for the resurrection of Jesus and the glory revealed that day. Help me to live in awe of His victory over death. In Jesus’ name, Amen."
901,Book of Mark,Book of Mark,"Authority, Servanthood, Urgency, Discipleship","Mark presents Jesus as the Servant-King who demonstrates His authority through action, calling His followers to serve and believe urgently.","Mark is the shortest Gospel, fast-moving and action-packed. It highlights Jesus’ miracles, authority over demons, and compassionate service. Unlike Matthew’s detailed teaching or John’s deep theology, Mark focuses on what Jesus did, showing His power and His servant heart. The central theme is discipleship: following Jesus means denying self, taking up the cross, and serving as He served. For me, Mark shows that the Kingdom of God advances not through pride or power but through the authority of Christ and the humility of service.","This book calls me to follow Jesus with urgency and humility, trusting His authority and imitating His servant heart.","Dear Heavenly Father, thank You for showing me Jesus as both powerful and humble. Help me to follow Him faithfully, serving others as He served. In Jesus’ name, Amen."
902,Mark 1:28,And immediately his fame spread abroad throughout all the region round about Galilee.,"Authority, Fame, Power of Jesus",News of Jesus spread quickly because of His authority over unclean spirits.,"After casting out a demon in Capernaum, Jesus’ fame spread immediately. His authority was undeniable, unlike anything people had seen. It reminds me that the Kingdom of God breaks through darkness with power, and the world cannot ignore it.",This calls me to trust in Jesus’ authority over all spiritual powers and to spread the news of His works.,"Dear Heavenly Father, thank You for Jesus’ authority over darkness. Help me trust His power and share His name boldly. In Jesus’ name, Amen."
903,Mark 2:17,"When Jesus heard it, he saith unto them, They that are whole have no need of the physician, but they that are sick: I came not to call the righteous, but sinners to repentance.","Grace, Calling, Salvation",Jesus came not for the righteous but for sinners in need of repentance.,"When criticized for eating with tax collectors and sinners, Jesus responded that a doctor is for the sick. His mission was clear: He came to call sinners, not those who considered themselves righteous. This reminds me that God’s grace reaches the broken, and His kingdom welcomes those who know their need.","This calls me to humility, recognizing my need for Christ daily, and to extend grace to others without self-righteousness.","Dear Heavenly Father, thank You that Jesus came for sinners like me. Keep me humble and filled with grace toward others who need Your mercy. In Jesus’ name, Amen."
904,Mark 3:21,"And when his friends heard of it, they went out to lay hold on him: for they said, He is beside himself.","Misunderstanding, Rejection, Perseverance","Misunderstanding, Rejection, Perseverance","This verse shows the painful reality that even those closest to Jesus misunderstood Him. His passion for ministry and obedience to the Father looked like madness to them. It reminds me that following God’s call may bring misunderstanding, even from loved ones.","This calls me to persevere in obedience, even when others do not understand or support me.","Dear Heavenly Father, strengthen me to follow You even when misunderstood. Help me endure with grace and remain faithful to Your call. In Jesus’ name, Amen."
905,Mark 4:24,"And he said unto them, Take heed what ye hear: with what measure ye mete, it shall be measured to you: and unto you that hear shall more be given.","Hearing, Responsibility, Growth",The measure I use to hear God’s Word will be the measure given back to me.,"Jesus urges His listeners to pay careful attention to His teaching. Spiritual growth depends on how we listen and respond. A generous, open heart receives more understanding, while a careless heart misses out. It reminds me that I must lean in and take God’s Word seriously.","This challenges me to approach God’s Word with hunger and humility, expecting Him to multiply what I receive.","Dear Heavenly Father, give me ears to hear Your Word with care and faith. Increase my understanding and grow me as I respond. In Jesus’ name, Amen."
906,Mark 5:19,"Howbeit Jesus suffered him not, but saith unto him, Go home to thy friends, and tell them how great things the Lord hath done for thee, and hath had compassion on thee.","Testimony, Mission, Grace",Jesus sent the healed man to tell others what God had done for him.,"After freeing the man possessed by a legion of demons, Jesus told him to return home and testify of God’s mercy. This shows the power of personal testimony—transformed lives speak loudly of God’s grace. It reminds me that I don’t need a pulpit; I just need to share what God has done for me.",This calls me to boldly share my story of God’s mercy and faithfulness with those around me.,"Dear Heavenly Father, thank You for the mercy You have shown me. Give me courage to share my testimony so others may know Your power and love. In Jesus’ name, Amen."
907,Mark 6:11,"And whosoever shall not receive you, nor hear you, when ye depart thence, shake off the dust under your feet for a testimony against them. Verily I say unto you, It shall be more tolerable for Sodom and Gomorrha in the day of judgment, than for that city.","Rejection, Responsibility, Judgment",Jesus told His disciples to shake the dust off their feet when rejected.,"This verse shows that not everyone will receive the message of Christ. When a town rejected the disciples, they were not to argue or force acceptance, but to leave it with God as a testimony. It reminds me that my responsibility is to witness faithfully, not to control the outcome.","This encourages me to share Christ faithfully, leaving results in God’s hands, and to keep moving forward when rejected.","Dear Heavenly Father, give me faithfulness to share Your Word and peace to leave the results with You. Help me not to be discouraged by rejection but to keep serving with joy. In Jesus’ name, Amen."
908,Mark 6:46,"And when he had sent them away, he departed into a mountain to pray.","Prayer, Solitude, Dependence on God","After ministry, Jesus withdrew to the mountain to pray.",This verse highlights Jesus’ rhythm of ministry—serving the crowds but retreating to commune with the Father. It reminds me that strength for public ministry flows from private prayer. Solitude with God refuels the soul and keeps the heart aligned.,"This challenges me to prioritize prayer, not as an afterthought but as the source of power and clarity for life.","Dear Heavenly Father, teach me to withdraw and seek You in prayer. Let my strength come from time in Your presence. In Jesus’ name, Amen."
909,Mark 7:25,"For a certain woman, whose young daughter had an unclean spirit, heard of him, and came and fell at his feet:","Desperation, Faith, Persistence","A Gentile woman sought Jesus, desperate for her daughter’s healing.","This verse introduces the Syrophoenician woman, who humbly yet persistently sought Jesus’ help. Her story shows that faith often begins with desperation, pressing through barriers to reach Christ. It reminds me that God honors humble, persistent faith.","This calls me to approach Jesus with humility and perseverance, trusting His compassion.","Dear Heavenly Father, give me the faith to press into You with humility and persistence. Thank You for Your mercy that reaches beyond boundaries. In Jesus’ name, Amen."
910,Mark 8:25,"After that he put his hands again upon his eyes, and made him look up: and he was restored, and saw every man clearly.","Healing, Clarity, Spiritual Sight",Jesus restored the blind man’s sight fully after touching him again.,"This healing is unique—Jesus touched the man twice. At first, he saw people like trees walking, then his sight was made clear. It reminds me that spiritual growth can be gradual, and God is patient in bringing clarity.","This encourages me to trust God’s process, even if healing or understanding comes in stages.","Dear Heavenly Father, thank You for patiently restoring sight and clarity. Help me to trust Your process as You bring me into greater vision. In Jesus’ name, Amen."
911,Mark 9:20,"And they brought him unto him: and when he saw him, straightway the spirit tare him; and he fell on the ground, and wallowed foaming.","Bondage, Authority, Deliverance",A boy tormented by an unclean spirit was brought trembling before Jesus.,"This verse sets the scene for a dramatic deliverance. The child convulsed violently at Jesus’ presence, showing the destructive power of the enemy but also the superior authority of Christ. It reminds me that no bondage is too great for Jesus to break.","This calls me to trust in Christ’s authority over all spiritual oppression, bringing my needs and the needs of others to Him.","Dear Heavenly Father, thank You for Jesus’ authority over every unclean spirit. Strengthen my faith to trust in His power to deliver and restore. In Jesus’ name, Amen."
912,Mark 10:2,"And the Pharisees came to him, and asked him, Is it lawful for a man to put away his wife? tempting him.","Testing, Marriage, Law",Pharisees questioned Jesus about divorce to test Him.,This verse shows religious leaders approaching Jesus not with sincerity but with the intent to trap Him. Their focus was on legal loopholes rather than God’s heart for marriage. It reminds me that testing Jesus with insincere motives misses the truth He offers.,"This challenges me to approach God’s Word with humility, seeking His heart rather than using it for debate or self-justification.","Dear Heavenly Father, help me to come to You with sincerity, not testing or twisting Your Word. Teach me to honor Your design for life and relationships. In Jesus’ name, Amen."
913,Mark 10:35,"And James and John, the sons of Zebedee, come unto him, saying, Master, we would that thou shouldest do for us whatsoever we shall desire.","Ambition, Misunderstanding, Servanthood",James and John asked Jesus for seats of honor in His kingdom.,"This request revealed their misunderstanding of greatness in God’s kingdom. They sought status, while Jesus would later teach that true greatness comes through servanthood and sacrifice. It reminds me of the temptation to seek recognition rather than humility.","This calls me to pursue greatness through serving others, following Jesus’ example.","Dear Heavenly Father, keep me from selfish ambition. Teach me to embrace humility and servanthood as the path to greatness in Your kingdom. In Jesus’ name, Amen."
914,Mark 11:18,"And the scribes and chief priests heard it, and sought how they might destroy him: for they feared him, because all the people was astonished at his doctrine.","Opposition, Authority, Fear","Religious leaders plotted to kill Jesus, yet feared the crowd.","After Jesus cleansed the temple, exposing corruption, the chief priests and scribes sought to destroy Him. Their fear of losing power drove them to violence, but the people recognized His authority. It reminds me that truth confronts corruption, and opposition often rises against it.","This challenges me to stand firm with Jesus, even when truth brings resistance.","Dear Heavenly Father, give me courage to stand with Christ even in the face of opposition. Help me honor His authority above human power. In Jesus’ name, Amen."
915,Mark 12:19,"Master, Moses wrote unto us, If a man’s brother die, and leave his wife behind him, and leave no children, that his brother should take his wife, and raise up seed unto his brother.","Law, Debate, Misunderstanding",The Sadducees tested Jesus with a question about marriage and resurrection.,"This verse introduces a contrived scenario meant to trap Jesus, showing the Sadducees’ disbelief in the resurrection. Their approach reveals how human reasoning without faith distorts God’s truth. Jesus’ response affirmed resurrection and God’s eternal power.",This calls me to trust God’s truth rather than approach Him with arguments or skepticism.,"Dear Heavenly Father, keep my heart free from skepticism and pride. Teach me to trust Your Word and live in hope of resurrection. In Jesus’ name, Amen."
916,Mark 13:5,"And Jesus answering them began to say, Take heed lest any man deceive you:","Deception, Watchfulness, End Times",Jesus warned His disciples to watch out so no one deceives them.,"This verse begins Jesus’ teaching about the end times. His first warning wasn’t about wars or disasters but about deception. It reminds me that spiritual discernment is crucial in every generation, especially when false voices try to lead people astray.","This calls me to stay alert, rooted in God’s truth, and not swayed by lies.","Dear Heavenly Father, keep me watchful and discerning. Protect me from deception and help me remain grounded in Your Word. In Jesus’ name, Amen."
917,Mark 14:3,"And being in Bethany in the house of Simon the leper, as he sat at meat, there came a woman having an alabaster box of ointment of spikenard very precious; and she brake the box, and poured it on his head.","Worship, Devotion, Sacrifice",A woman anointed Jesus with costly perfume as an act of love and honor.,"This moment reveals extravagant devotion. While others criticized the woman for waste, Jesus praised her act as beautiful and prophetic, preparing Him for burial. It reminds me that true worship is costly, springing from love rather than calculation.","This challenges me to give Jesus my best, holding nothing back in devotion and worship.","Dear Heavenly Father, help me to honor You with wholehearted devotion. Teach me to give generously in worship, not counting the cost. In Jesus’ name, Amen."
918,Mark 14:35,"And he went forward a little, and fell on the ground, and prayed that, if it were possible, the hour might pass from him.","Surrender, Prayer, Submission","In Gethsemane, Jesus prayed for the cup to pass, yet surrendered to the Father’s will.","This verse reveals Jesus’ deep anguish as He faced the cross. His prayer shows both His humanity—desiring another way—and His perfect obedience, choosing the Father’s will. It reminds me that true surrender often comes in prayerful wrestling.","This calls me to trust God’s will, even when it is painful or costly.","Dear Heavenly Father, help me to surrender my will to Yours. Strengthen me to trust Your plan even when it is hard. In Jesus’ name, Amen."
919,Mark 14:72,"And the second time the cock crew. And Peter called to mind the word that Jesus said unto him, Before the cock crow twice, thou shalt deny me thrice. And when he thought thereon, he wept.","Failure, Conviction, Repentance",Peter denied Jesus three times and wept bitterly when the rooster crowed.,"This verse highlights Peter’s failure and heartbreak. His confidence in himself gave way to fear, yet his tears marked the beginning of repentance. It reminds me that even in failure, God’s grace offers restoration, as Jesus later reinstated Peter.",This encourages me to face my failures honestly and trust God’s mercy to restore me.,"Dear Heavenly Father, forgive me for the times I have denied You in weakness. Thank You for Your mercy that restores me when I repent. In Jesus’ name, Amen."
920,Mark 15:39,"And when the centurion, which stood over against him, saw that he so cried out, and gave up the ghost, he said, Truly this man was the Son of God.","Revelation, Faith, Identity of Christ","The centurion confessed, “Surely this man was the Son of God.”","As Jesus breathed His last, even a Roman centurion recognized His true identity. This declaration at the cross shows the power of Jesus’ sacrifice to open eyes and hearts, even among those who once opposed Him. It reminds me that the cross is the clearest revelation of Christ’s identity and love.","This calls me to confess Christ openly, recognizing Him as the Son of God who gave His life for me.","Dear Heavenly Father, thank You for the revelation of Jesus at the cross. Help me boldly confess Him as Lord and live in the power of His sacrifice. In Jesus’ name, Amen."
921,Book of Luke,Book of Luke,"Salvation, Compassion, The Kingdom of God, Universality of the Gospel","Luke presents Jesus as the Son of Man who came to seek and save the lost, highlighting His compassion, prayer life, and concern for the outcast.","Luke’s Gospel is the most detailed narrative of Jesus’ life, emphasizing His humanity and compassion. Written by a physician and historian, Luke carefully investigated everything and showed how Jesus is the Savior for all—Jews, Gentiles, men, women, rich, and poor. It highlights prayer, the work of the Holy Spirit, and Jesus’ mission to bring salvation to the least, the last, and the lost. For me, Luke reassures that no one is beyond the reach of Christ’s love, and His kingdom breaks down barriers to bring restoration to all.","This book calls me to embrace Jesus’ compassion, share His good news broadly, and follow His example of prayer and dependence on the Spirit.","Dear Heavenly Father, thank You for sending Jesus as the Savior for all. Help me to live in His compassion and share His love with those around me. In Jesus’ name, Amen."
922,Luke 1:33,And he shall reign over the house of Jacob for ever; and of his kingdom there shall be no end.,"Kingdom, Eternity, Christ’s Reign",Jesus will reign forever over a kingdom without end.,"The angel’s promise to Mary declared Jesus as the eternal King in David’s line. Unlike earthly rulers, His kingdom would never end. This points to the ultimate hope in Christ’s eternal reign.",This calls me to anchor my hope not in temporary powers but in the everlasting kingdom of Christ.,"Dear Heavenly Father, thank You that Jesus reigns forever. Keep my heart loyal to His kingdom above all else. In Jesus’ name, Amen."
923,Luke 1:71,"That we should be saved from our enemies, and from the hand of all that hate us;","Salvation, Deliverance, Covenant","God promised deliverance from enemies, fulfilling His covenant of salvation.","This verse is part of Zechariah’s song, praising God for raising up salvation through Christ. It reminds me that God’s promises are sure, and His salvation delivers from sin and fear.",This encourages me to trust God’s covenant promises and live in the freedom of His salvation.,"Dear Heavenly Father, thank You for salvation and deliverance in Christ. Help me to walk in the freedom of Your covenant promises. In Jesus’ name, Amen."
924,Luke 2:24,"And to offer a sacrifice according to that which is said in the law of the Lord, A pair of turtledoves, or two young pigeons.","Obedience, Humility, Dedication",Mary and Joseph offered a humble sacrifice in obedience to the law.,"This verse shows Jesus’ parents bringing the offering of two doves or pigeons—a provision for the poor—when presenting Him at the temple. It reveals their obedience and humility, and it reminds me that Jesus entered the world in simplicity and identification with the lowly.","This challenges me to walk in obedience and humility, honoring God with what I have.","Dear Heavenly Father, thank You for Jesus’ humble beginnings that show Your heart for the lowly. Help me to obey You with sincerity and humility. In Jesus’ name, Amen."
925,Luke 3:4,"As it is written in the book of the words of Esaias the prophet, saying, The voice of one crying in the wilderness, Prepare ye the way of the Lord, make his paths straight.","Preparation, Repentance, Fulfillment","John the Baptist prepared the way for the Lord, calling people to repentance.","Quoting Isaiah, this verse shows John as the voice crying out in the wilderness, preparing hearts for the Messiah. His message of repentance made the way straight for Jesus’ ministry. It reminds me that preparation for God’s work always begins with repentance and humility.",This calls me to prepare my heart daily by repenting and making room for Christ’s reign in my life.,"Dear Heavenly Father, help me to prepare the way for You in my heart. Teach me to walk in repentance and readiness for Your work. In Jesus’ name, Amen."
926,Luke 4:1,"And Jesus being full of the Holy Ghost returned from Jordan, and was led by the Spirit into the wilderness,","Spirit, Wilderness, Testing","Jesus, full of the Spirit, was led into the wilderness to be tested.","This verse highlights that after His baptism, Jesus was Spirit-filled and Spirit-led—even into testing. The wilderness was not a sign of abandonment but a place of preparation. It reminds me that God uses trials to strengthen and confirm His work in me.","This challenges me to trust the Spirit’s leading, even into difficult seasons, knowing they serve a greater purpose.","Dear Heavenly Father, fill me with Your Spirit and lead me faithfully. Help me to trust You in times of testing and wilderness. In Jesus’ name, Amen."
