Number,Reference,verse_text (KJV),Themes,Quick Reflection,Extended Reflection,Alignment ,Prayer
224,Judges 16:28,"And Samson called unto the LORD, and said, O Lord GOD, remember me, I pray thee, and strengthen me, I pray thee, only this once, O God, that I may be at once avenged of the Philistines for my two eyes.","Repentance, Strength, Prayer, God’s Power","Samson prayed for strength one last time, asking God to remember him and grant victory over his enemies.","This verse captures Samson’s final act of dependence on God. Though his life was marked by failure, in his last moment he cried out for mercy. God answered, showing that His strength is greater than human weakness. It reminds me that even at my lowest, I can turn back to God, and His power can still work through me.",This encourages me that it is never too late to return to God—His mercy can redeem even my final moments.,"Dear Heavenly Father, thank You for Your mercy that meets me even in weakness. Help me to trust Your strength and turn to You always. In Jesus’ name, Amen."
225,Judges 18:11,"And there went from thence of the family of the Danites, out of Zorah and out of Eshtaol, six hundred men appointed with weapons of war.","Idolatry, Compromise, Departure, Rebellion","Six hundred men of Dan set out with weapons, part of a move that would lead to idolatry and disobedience.","This verse sets the stage for Dan’s tragic descent into idolatry. Instead of seeking God’s inheritance faithfully, they took matters into their own hands. Their journey, though bold, was marked by rebellion. It reminds me that stepping out in strength means nothing if it isn’t aligned with God’s will.","This calls me to make sure my steps are aligned with God’s direction, not just my own plans.","Dear Heavenly Father, guide my steps so I don’t walk in self-will. Keep me aligned with Your purposes and away from compromise. In Jesus’ name, Amen."
226,Judges 19:8,"And he arose early in the morning on the fifth day to depart: and the damsel’s father said, Comfort thine heart, I pray thee. And they tarried until afternoon, and they did eat both of them.","Delay, Hospitality, Human Weakness, Missed Opportunity","The Levite’s father-in-law persuaded him to stay longer, delaying his departure.","This verse may seem like a simple detail, but it sets the stage for tragedy. Delay kept the Levite in a place of danger instead of moving forward. It shows how hesitation or misplaced hospitality can affect outcomes. For me, it is a reminder to listen carefully for God’s timing and not let distractions keep me from obedience.","This challenges me to be discerning with time, moving when God calls instead of lingering where I shouldn’t.","Dear Heavenly Father, help me to discern Your timing clearly. Keep me from unnecessary delays that pull me away from Your will. In Jesus’ name, Amen."
227,Judges 20:5,"And the men of Gibeah rose against me, and beset the house round about upon me by night, and thought to have slain me: and my concubine have they forced, that she is dead.","Violence, Injustice, Grievance, Brokenness","The Levite explained how the men of Gibeah rose against him and his concubine, exposing Israel’s deep moral decay.","This verse comes in the middle of one of the darkest stories in Scripture. It reveals the horrific sin and violence present in Israel when “everyone did what was right in their own eyes.” It reminds me of the dangers of abandoning God’s ways—chaos and injustice always follow. Even in its darkness, the passage points to humanity’s desperate need for a righteous Deliverer.","This reminds me that apart from God’s ways, sin corrupts deeply. I need His truth to keep me from drifting into chaos.","Dear Heavenly Father, keep me from the deception of doing what seems right in my own eyes. Anchor me in Your truth and make me a light in a dark world. In Jesus’ name, Amen."
228,Judges 20:35,And the LORD smote Benjamin before Israel: and the children of Israel destroyed of the Benjamites that day twenty and five thousand and an hundred men: all these drew the sword.,"Judgment, Victory, God’s Sovereignty, Consequence","The Lord struck down the Benjamites before Israel, giving victory in a devastating battle.","This verse is sobering. Israel’s own tribe, Benjamin, was defeated because of unrepentant sin. The battle was fierce, but it was God who determined the outcome. It reminds me that sin within God’s people cannot be ignored, and judgment begins in His house. Yet even here, God’s sovereignty and justice were at work.",This calls me to take sin seriously in my own life and to remember that God is both merciful and just.,"Dear Heavenly Father, keep me from ignoring sin. Help me walk in repentance and humility, trusting Your justice and mercy. In Jesus’ name, Amen."
229,Judges 21:20,"Therefore they commanded the children of Benjamin, saying, Go and lie in wait in the vineyards;","Preservation, Continuation, Mercy, New Beginnings","Israel told the Benjamites to find wives so that their tribe would not disappear, ensuring their survival.","After devastation, this verse shows God’s mercy working through human action to preserve a tribe from extinction. Though the story of Judges is full of rebellion and tragedy, God still made a way for His covenant people to continue. It reminds me that even in brokenness and failure, He brings new beginnings and preserves His purposes.","This reassures me that God can bring restoration out of ruin, ensuring His plan continues through mercy.","Dear Heavenly Father, thank You for Your mercy that preserves me even when I fail. Bring new beginnings where I see brokenness and keep me aligned with Your purpose. In Jesus’ name, Amen."
230,Book of Ruth,Book of Ruth,"Redemption, Loyalty, Faithfulness, Providence, Restoration","Ruth tells the story of a Moabite woman’s loyalty to her mother-in-law, Naomi, and how God used her faithfulness to weave redemption into Israel’s story, ultimately leading to the line of David and Christ.","The Book of Ruth shines as a bright thread of hope against the dark backdrop of Judges. It begins with loss and famine but ends with blessing and redemption. Ruth’s loyalty to Naomi—“your people will be my people, and your God my God”—reveals steadfast love and covenant faith. Through her humble obedience, God guided her steps to Boaz, her kinsman-redeemer. This union restored Naomi’s family line and became part of the genealogy of Jesus Christ. Ruth reminds me that God’s providence works even in ordinary acts of faithfulness, turning grief into joy and weaving personal lives into His larger plan of salvation.","This book calls me to live faithfully in the small choices, trusting that God is at work behind the scenes to bring redemption and purpose out of my story.","Dear Heavenly Father, thank You for the story of Ruth that reminds me of Your providence and redemption. Help me to be faithful in love and obedience, trusting that You are working all things together for good. Use my life, like Ruth’s, to point to Jesus, the true Redeemer. In His name, Amen."
231,Ruth 2:4,"And behold, Boaz came from Bethlehem, and said unto the reapers, The LORD be with you. And they answered him, The LORD bless thee.","Kindness, Blessing, God’s Presence, Favor","Boaz greeted the harvesters with a blessing, showing his godly character and the presence of the Lord in daily life.","This simple greeting reveals much about Boaz. He was a man whose faith shaped his speech and actions, carrying God’s blessing into ordinary work. It reminds me that faith isn’t just expressed in big moments but in daily interactions. God often reveals His favor and presence through people who choose to speak life","This encourages me to bring God’s blessing into everyday moments, letting His presence show in how I speak to othe","Dear Heavenly Father, help me to carry Your presence into my daily life. Let my words and actions reflect Your kindness and bring blessing to others. In Jesus’ name, Amen."
232,Ruth 3:7,"And when Boaz had eaten and drunk, and his heart was merry, he went to lie down at the end of the heap of corn: and she came softly, and uncovered his feet, and laid her down.","Obedience, Humility, Covenant, Trust","Ruth approached Boaz at night as Naomi instructed, humbly placing herself at his feet in trust.","This verse shows Ruth’s courage and humility. She followed Naomi’s guidance, trusting both her wisdom and God’s providence. By lying at Boaz’s feet, she was essentially seeking his role as kinsman-redeemer. It reminds me that true faith often looks like vulnerable obedience—placing myself in God’s hands, even when I don’t see the outcome.","This calls me to step into obedience with humility, trusting God’s providence in the unknown.","Dear Heavenly Father, give me the courage to walk in obedience even when it feels vulnerable. Help me to rest at Your feet, trusting Your redemption and provision. In Jesus’ name, Amen."
233,Ruth 4:14,"And the women said unto Naomi, Blessed be the LORD, which hath not left thee this day without a kinsman, that his name may be famous in Israel.","Redemption, Joy, Restoration, God’s Faithfulness",The women praised the Lord because He had provided a redeemer for Naomi’s family through Ruth and Boaz.,"This verse marks the joyful climax of Ruth’s story. What began in bitterness and loss ended in restoration and hope. God provided a redeemer, not just for Naomi’s family line but ultimately for the world through Christ. It reminds me that God specializes in turning mourning into joy and weaving personal pain into His redemptive plan.",This reminds me to celebrate God’s faithfulness and trust that He is working redemption even in my broken places.,"Dear Heavenly Father, thank You for being the God of redemption. Turn my sorrows into joy and use my story to reflect the hope found in Christ. In Jesus’ name, Amen."
234,Book of 1 Samual,Book of 1 Samual,"Transition, Kingship, Obedience, Anointing, God’s Sovereignty","1 Samuel marks Israel’s transition from judges to kings. It introduces Samuel the prophet, Saul the first king, and David the man after God’s heart. The book highlights obedience vs. disobedience and God’s sovereignty in raising up leaders.","The story of 1 Samuel begins with Hannah’s prayer and God’s answer in Samuel, a prophet who would guide Israel in a time of transition. As the people demanded a king, Saul was chosen, but his disobedience led to downfall. In contrast, David’s anointing reveals God’s heart: He values faithfulness and obedience over outward appearance. The book weaves together themes of prayer, leadership, pride, humility, and God’s sovereign plan. It reminds me that God raises up and removes leaders according to His will, and He looks at the heart, not human status. Ultimately, 1 Samuel shows that God is the true King, and even in times of human failure, His purposes prevail.","This calls me to value obedience over appearance and to trust God’s sovereignty in seasons of transition. He sees my heart and asks me to walk faithfully with Him, no matter what role I hold.","Dear Heavenly Father, thank You for showing me through 1 Samuel that You are the true King. Help me to walk in obedience and humility, trusting Your plan even in times of change. Teach me to live faithfully so that my life reflects Your heart. In Jesus’ name, Amen."
235,1 Sam 1:28,Therefore also I have lent him to the LORD; as long as he liveth he shall be lent to the LORD. And he worshipped the LORD there.,"Dedication, Surrender, Faithfulness, Prayer Answered","Hannah dedicated Samuel to the Lord, giving back the child she had prayed for.","This verse is a powerful picture of surrender. Hannah’s deepest longing was answered, yet she kept her vow by entrusting Samuel fully to God’s service. It reminds me that answered prayers are not for my possession alone—they are opportunities to glorify God through obedience. True faith holds blessings with open hands.","This teaches me to honor God with the very blessings He gives, dedicating them back to His purpose.","Dear Heavenly Father, thank You for Your faithfulness in answering prayer. Help me to surrender every blessing back to You, trusting Your purpose above my own. In Jesus’ name, Amen."
236,1 Sam 2:23,"And he said unto them, Why do ye such things? for I hear of your evil dealings by all this people.","Sin, Accountability, Leadership, Warning","Eli rebuked his sons for their wicked actions, but their sin had already dishonored God’s priesthood.","This verse highlights the danger of unchecked sin, especially among those in spiritual leadership. Eli’s sons abused their position, leading others astray, and Eli’s rebuke came too late. It reminds me that sin tolerated is sin multiplied, and spiritual leaders carry heavy responsibility before God.",This warns me to take sin seriously—both in my own life and in the influence I have over others.,"Dear Heavenly Father, keep me from tolerating sin. Give me courage to walk in holiness and lead others with integrity. In Jesus’ name, Amen."
237,1 Sam 3:18 ,"And Samuel told him every whit, and hid nothing from him. And he said, It is the LORD: let him do what seemeth him good.","Surrender, Obedience, God’s Word, Acceptance","Samuel told Eli everything God had spoken, and Eli humbly accepted God’s will, even in judgment.","This moment shows two forms of surrender: Samuel’s courage to speak God’s word without fear, and Eli’s humility in accepting a difficult truth. It reminds me that obedience means both speaking truth and receiving it. God’s word is not always easy, but it is always good and necessary.","This calls me to both speak and receive God’s word with humility, even when it challenges me.","Dear Heavenly Father, give me courage to speak Your truth and humility to accept it. Help me to trust Your word, even when it is hard. In Jesus’ name, Amen."
238,1 Sam 5:1,"And the Philistines took the ark of God, and brought it from Eben-ezer unto Ashdod.","Defeat, God’s Presence, Misplaced Trust, Consequence",The Philistines captured the ark of God and brought it into the temple of Dagon.,"This verse reveals Israel’s mistake in treating the ark like a lucky charm rather than honoring God Himself. When the ark was captured, it exposed their misplaced trust and revealed God’s sovereignty. The ark in enemy hands would soon show that God is not defeated even when His people are. It reminds me that God’s presence cannot be manipulated—He is Lord, not an object to control.","This teaches me to place my trust in God Himself, not in symbols, traditions, or routines that I might treat as substitutes.","Dear Heavenly Father, keep my faith rooted in You alone. Help me not to treat Your presence lightly or use spiritual things as a substitute for true devotion. In Jesus’ name, Amen"
239,1 Sam 6:15,"And the Levites took down the ark of the LORD, and the coffer that was with it, wherein the jewels of gold were, and put them on the great stone: and the men of Beth-shemesh offered burnt offerings and sacrificed sacrifices the same day unto the LORD.","Worship, Restoration, Reverence, Offering",The Levites placed the ark on a large stone and offered burnt sacrifices when it was returned.,"After the ark’s capture and God’s display of power among the Philistines, its return was a moment of restored reverence. The Levites responded rightly—with worship and sacrifice. It reminds me that when God restores what was lost, my first response should be gratitude and worship, not self-focus.",This encourages me to honor God with thanksgiving whenever He restores or delivers me.,"Dear Heavenly Father, thank You for restoring what the enemy tries to take. Help me to honor You with worship and gratitude for every act of Your faithfulness. In Jesus’ name, Amen."
240,1 Sam 8:4,"Then all the elders of Israel gathered themselves together, and came to Samuel unto Ramah,","Leadership, Desire, Rejection, Transition","Israel’s elders demanded a king, rejecting God’s direct rule over them.","This verse marks a turning point in Israel’s history. Instead of trusting God as their King, they wanted to be like other nations. It reminds me that seeking what looks normal in the world often means rejecting God’s best. His leadership is perfect, but He allows me the freedom to choose—even when my choices grieve His heart.",This calls me to trust God’s leadership instead of longing for what the world offers.,"Dear Heavenly Father, forgive me for the times I’ve wanted to fit in rather than follow You. Teach me to trust Your kingship over my life. In Jesus’ name, Amen."
241,1 Sam 9:13,"As soon as ye be come into the city, ye shall straightway find him, before he go up to the high place to eat: for the people will not eat until he come, because he doth bless the sacrifice; and afterwards they eat that be bidden. Now therefore get you up; for about this time ye shall find him.","Providence, Timing, God’s Guidance, Obedience","Saul arrived at the right time to meet Samuel, showing God’s hand in orchestrating events.","This verse highlights God’s providence in arranging encounters. Saul was unaware, but God was guiding his steps to Samuel, preparing him for kingship. It reminds me that nothing is coincidence—God weaves timing and details for His purposes. When I walk in obedience, I often find myself at the right place at the right time by His design.","This reassures me to trust God’s timing, knowing He is arranging my steps even when I don’t see the full picture.","Dear Heavenly Father, thank You for ordering my steps. Help me to trust that You are at work in the details, guiding me toward Your purpose. In Jesus’ name, Amen."
242,1 Sam 10:12,"And one of the same place answered and said, But who is their father? Therefore it became a proverb, Is Saul also among the prophets?","Calling, Identity, Surprise, God’s Anointing","People questioned Saul’s prophetic experience, surprised at how God’s Spirit had come upon him.","This verse shows how God’s anointing can surprise others. Saul, an ordinary man, was transformed when the Spirit came on him. It reminds me that God’s calling is not limited by background or expectation. When He chooses and empowers, others may question, but His Spirit confirms the calling.","This encourages me to embrace God’s calling, even if others doubt or don’t understand.","Dear Heavenly Father, thank You for calling me beyond what others expect. Help me to walk boldly in the anointing You’ve given, trusting Your Spirit to equip me. In Jesus’ name, Amen."
243,1 Sam 11:10,"Therefore the men of Jabesh said, To morrow we will come out unto you, and ye shall do with us all that seemeth good unto you.","Deliverance, Strategy, Trust, Victory","The men of Jabesh pretended to surrender, but it was part of a plan that led to their deliverance through Saul’s army.","This verse shows how God can turn apparent weakness into an opportunity for victory. While the enemy thought they had won, God was already orchestrating deliverance. It reminds me that God’s plans are not always obvious, but His timing and strategy bring rescue at just the right moment.","This encourages me to trust that even when situations look bleak, God is working a greater plan for victory.","Dear Heavenly Father, help me to trust Your strategy even when I can’t see the outcome. Thank You for being my deliverer in times of trouble. In Jesus’ name, Amen."
244,1 Sam 12:21,"And turn ye not aside: for then should ye go after vain things, which cannot profit nor deliver; for they are vain.","Idolatry, Faithfulness, Obedience, Focus","Samuel warned Israel not to turn aside to useless idols, which cannot deliver or help.","This verse reminds me that anything I place above God becomes an idol, and idols always fail. Samuel urged the people to stay faithful to the Lord, who alone delivers and sustains. It’s a call to single-hearted devotion, resisting the pull of distractions and empty substitutes.","This calls me to keep my heart fixed on God, rejecting anything that competes with His rightful place.","Dear Heavenly Father, keep me from chasing after worthless things. Help me to remain faithful and focused on You alone. In Jesus’ name, Amen."
245,1 Sam 13:23,And the garrison of the Philistines went out to the passage of Michmash.,"Conflict, Preparation, Tension, God’s Hand","The Philistines stationed a garrison at Michmash, setting the stage for conflict with Israel.","Though this verse seems like a military detail, it marks the growing tension between Israel and its enemies. It reminds me that battles often build slowly, and God allows pressure to rise to prepare His people for dependence on Him. What looks like opposition is often preparation for His deliverance.","This teaches me not to fear opposition, but to see it as an opportunity for God to show His power.","Dear Heavenly Father, help me to trust You when I face growing pressure. Use every challenge to strengthen my dependence on You. In Jesus’ name, Amen."
246,1 Sam 14:29,"Then said Jonathan, My father hath troubled the land: see, I pray you, how mine eyes have been enlightened, because I tasted a little of this honey.","Strength, Obedience, Renewal, God’s Provision","Jonathan tasted honey and his eyes brightened, showing renewed strength despite Saul’s rash oath.","This verse highlights both human weakness and God’s provision. While Saul’s oath burdened the people, Jonathan found strength in the sweetness God provided. It reminds me that God gives refreshment in the midst of battle, even when human leadership falters. His provision renews me when I feel faint.","This encourages me to receive God’s provision with gratitude, trusting Him to refresh me in my weariness.","Dear Heavenly Father, thank You for being my source of strength. Refresh my spirit in times of battle, and keep me focused on the life You provide. In Jesus’ name, Amen."
247,1 Sam 15:3,"Now go and smite Amalek, and utterly destroy all that they have, and spare them not; but slay both man and woman, infant and suckling, ox and sheep, camel and ass.","Obedience, Judgment, Command, Testing","God commanded Saul to completely destroy the Amalekites, leaving nothing alive.","This verse feels heavy, but it reveals the seriousness of God’s command. The Amalekites had persistently opposed Him, and Saul’s obedience was to be absolute. It reminds me that obedience isn’t partial—it’s complete, even when I don’t fully understand. God tests the heart through whether I follow fully or pick and choose.","This challenges me to honor God’s commands in full, trusting His wisdom even when it stretches my understanding.","Dear Heavenly Father, help me to walk in full obedience to You. Keep me from compromise, and teach me to trust Your wisdom above my own. In Jesus’ name, Amen."
248,1 Sam 15:34,Then Samuel went to Ramah; and Saul went up to his house to Gibeah of Saul.,"Grief, Separation, Consequence, Leadership","Samuel grieved over Saul, but he never went to see him again after the Lord rejected Saul as king.","This verse captures the heartbreak of disobedience. Saul’s failure brought distance between him, Samuel, and God. Samuel mourned because leadership had been squandered, and a calling lost. It reminds me that sin not only damages my own walk, but also wounds relationships and wastes opportunities.","This urges me to live faithfully so that my choices strengthen, not sever, the relationships God has entrusted me with.","Dear Heavenly Father, keep me from the sorrow of wasted opportunities. Help me to live faithfully, honoring the call You’ve placed on my life. In Jesus’ name, Amen."
249,1 Sam 17:3,"And the Philistines stood on a mountain on the one side, and Israel stood on a mountain on the other side: and there was a valley between them.","Conflict, Opposition, Fear, Challenge","Israel and the Philistines faced each other across the valley, setting the stage for Goliath’s challenge.","This verse describes a physical battlefield, but it symbolizes spiritual battles I face. The enemy often positions himself directly against God’s people, trying to intimidate and discourage. The tension here points to the need for faith—not in strength or numbers, but in the Lord.","This reminds me to see my battles through the lens of faith, trusting God’s power to face the enemy.","Dear Heavenly Father, help me not to fear when opposition stands before me. Teach me to face challenges with faith, knowing You are greater than any enemy. In Jesus’ name, Amen."
250,1 Sam 17:34,"And David said unto Saul, Thy servant kept his father’s sheep, and there came a lion, and a bear, and took a lamb out of the flock:","Courage, Faith, Preparation, God’s Deliverance","David recalled how he fought lions and bears while protecting his sheep, testifying to God’s deliverance.","This verse shows how God uses past experiences to build faith for present battles. David’s courage against Goliath wasn’t blind—it was rooted in what God had already done for him. It reminds me that my past victories, even small ones, are testimonies preparing me for greater challenges.",This encourages me to remember God’s past faithfulness as fuel for courage in today’s battles,"Dear Heavenly Father, thank You for every time You’ve delivered me before. Strengthen my faith to trust You again for the battles I face now. In Jesus’ name, Amen."
