Number,Reference,verse_text (KJV),Themes,Quick Reflection,Extended Reflection,Alignment ,Prayer
1,Book of Genesis,Book of Genesis,"Beginnings, Creation, Calling","New starts belong to God. Genesis opens with God’s initiative—He speaks, forms, and blesses. When a new chapter begins in my life, I want to start by listening for His voice and naming what He is forming, not what I fear.","The Book of Genesis is not just ancient history but the foundation of faith. In its pages, God creates light out of darkness, calls Abraham out of idolatry, preserves Noah in the flood, and wrestles with Jacob until he is transformed into Israel. The KJV’s cadence underscores both the grandeur and the intimacy of these moments. Genesis reveals that humanity’s failures are never the end of the story — God’s covenant faithfulness carries through. For me, it is a call to return often to the beginning: to remember who made me, who calls me, and who promises to redeem what is broken.","Genesis shows me that every part of my walk has a beginning that traces back to God. Just as He spoke creation into order, called Abraham into covenant, and shaped Jacob into Israel, He is also forming my story. I need to align my choices with His design instead of trying to write my own script. Genesis reminds me to return to God as my source, trust His promises even when unseen, and let Him set the direction of every new start.","Dear Heavenly Father, Creator of beginnings, thank You for laying the foundation of all things in Genesis. Teach me to trust Your Word as the first and final authority in my life. Guide me to walk by faith like Abraham, endure trials like Joseph, and cling to Your covenant promises with hope. I pray this in the name of Jesus Christ, Amen."
2,Genesis chapter 2,"Thus the heavens and the earth were finished, and all the host of them. And on the seventh day God ended his work which he had made; and he rested on the seventh day from all his work which he had made. And God blessed the seventh day, and sanctified it: because that in it he had rested from all his work which God created and made. These are the generations of the heavens and of the earth when they were created, in the day that the LORD God made the earth and the heavens, And every plant of the field before it was in the earth, and every herb of the field before it grew: for the LORD God had not caused it to rain upon the earth, andthere was not a man to till the ground. But there went up a mist from the earth, and watered the whole face of the ground. And the LORD God formed man of the dust of the ground, and breathed into his nostrils the breath of life; and man became a living soul. And the LORD God planted a garden eastward in Eden; and there he put the man whom he had formed. And out of the ground made the LORD God to grow every tree that is pleasant to the sight, and good for food; the tree of life also in the midst of the garden, and the tree of knowledge of good and evil. And a river went out of Eden to water the garden; and from thence it was parted, and became into four heads. The name of the first is Pison: that is it which compasseth the whole land of Havilah, where there is gold; And the gold of that land is good: there is bdellium and the onyx stone. And the name of the second river is Gihon: the same is it that compasseth the whole land of Ethiopia. And the name of the third river is Hiddekel: that is  it which goeth toward the east of Assyria. And the fourth river is Euphrates. And the LORD God took the man, and put him into the garden of Eden to dress it and to keep it. And the LORD God commanded the man, saying, Of every tree of the garden thou mayest freely eat: But of the tree of the knowledge of good and evil, thou shalt not eat of it: for in the day that thou eatest thereof thou shalt surely die. And the LORD God said, It is not good that the man should be alone; I will make him an help meet for him. And out of the ground the LORD God formed every beast of the field, and every fowl of the air; and brought them unto Adam to see what he would call them: and whatsoever Adam called every living creature, that was the name thereof. And Adam gave names to all cattle, and to the fowl of the air, and to every beast of the field; but for Adam there was not found an help meet for him. And the LORD God caused a deep sleep to fall upon Adam and he slept: and he took one of his ribs, and closed up the flesh instead thereof; And the rib, which the LORD God had taken from man, made he a woman, and brought her unto the man. And Adam said, This is now bone of my bones, and flesh of my flesh: she shall be called Woman, because she was taken out of Man. Therefore shall a man leave his father and his mother, and shall cleave unto his wife: and they shall be one flesh. And they were both naked, the man and his wife, and were not ashamed.","Beginnings, Creation, Promise","slows the pace—Sabbath, breath, and belonging. God places people in a garden to cultivate, not to grind. My work and relationships flourish when they flow from rest with God, not rush.","Genesis chapter 2 is not just a continuation but a deepening of creation’s story. The KJV’s phrasing emphasizes completion and blessing: “Thus the heavens and the earth were finished, and all the host of them.” This chapter introduces rest as holy, man as formed from dust and breath, and woman as a companion fitly made. Together they are placed in Eden, not for endless toil but to “dress it and to keep it.” For me, this highlights that life is meant to be stewarded from a posture of rest and relationship with God, not driven striving.","I need to let God’s rhythm of rest shape my own. Sabbath isn’t wasted time but the soil for obedience. Like Adam and Eve, I’m called to cultivate what God gives me—relationships, responsibilities, even creation itself—without letting busyness push me away from His presence.","Dear Heavenly Father, Yahweh Shalom, thank You for teaching me holy rest. Root my work and relationships in Your presence so I may faithfully steward what You plant. I pray this in the name of Jesus Christ, Amen."
3,Genesis 3:9,"And the LORD God called unto Adam, and said unto him, Where art thou?","Conviction, Pursuit, Repentance","God’s question, “Where art thou?” reveals His pursuit even after sin. Shame makes us hide, but God still calls out.","In the garden, Adam and Eve break fellowship with God. Yet the first voice is not their excuse but God’s pursuit: “Where art thou?” The KJV’s simplicity highlights the seriousness of sin and the gentleness of God’s invitation. This verse shows that even when humanity fails, God initiates the way back.","I must answer God honestly about where I stand. Hiding delays healing. When I confess, I step into the restoration He already offers through Christ.","Dear Heavenly Father, thank You for pursuing me even when I hide. Give me courage to answer honestly and to walk back into Your light. I pray this in the name of Jesus Christ, Amen."
4,Genesis 4:13,"And Cain said unto the LORD, My punishment is greater than I can bear.","Consequences, Mercy, Honesty","Cain’s cry, “My punishment is greater than I can bear,” shows the crushing weight of sin. Yet God’s response isn’t abandonment but protection. Even in judgment, His mercy leaves a mark of grace.","Genesis 4:13 captures the human heart when faced with sin’s fallout — regret over punishment rather than repentance over the act itself. Cain feels the burden but does not confess the root. Still, the narrative reminds me that God does not abandon even the guilty; He sets a mark of protection, restraining vengeance. In the KJV, the solemn wording magnifies both justice and mercy. This tension is where I live too — my choices have consequences, but God’s mercy surrounds me so destruction doesn’t have the final word.","I need to confess honestly, not just complain about consequences. God calls me to face the reality of my sin, accept responsibility, and then trust His mercy to guard me from being overcome by shame or fear.","Dear Heavenly Father, God of justice and mercy, teach me to confess without excuses. Let me trust Your protecting grace even when I feel the weight of my failures. I pray this in the name of Jesus Christ, Amen."
5,Genesis 6:1,"And it came to pass, when men began to multiply on the face of the earth, and daughters were born unto them,","Purity, Corruption, Separation","As people multiplied, corruption spread. Yet God still preserved a line of righteousness. When the crowd pursues compromise, holiness becomes the rare refuge.","Genesis 6:1 marks a turning point: “And it came to pass, when men began to multiply on the face of the earth…” The expansion of humanity also expands sin’s reach. This verse sets the stage for the flood, showing that numbers and progress mean little when purity is lost. In the KJV, the cadence underscores both the ordinary growth of mankind and the extraordinary decline of their hearts. For me, it’s a reminder that increase without godliness leads to destruction. God, however, always preserves a remnant, calling some to walk differently even when the culture decays.","I must guard my heart when compromise feels common. The path with God is often the narrow one, requiring separation from the patterns of corruption. Like Noah, my task is to build faithfulness even before judgment comes.","Dear Heavenly Father, keep me pure when the world turns corrupt. Give me courage to live differently, and help me to prepare in faith for what You are doing. I pray this in the name of Jesus Christ, Amen."
6,Genesis 7:12,And the rain was upon the earth forty days and forty nights.,"Judgment, Refuge, Endurance","The rain fell forty days and nights, but God had already provided the ark. Obedience gave Noah shelter before the storm arrived.","Genesis 7:12 says, “And the rain was upon the earth forty days and forty nights.” This simple statement carries weight: judgment came exactly as God said. Yet the focus is not on the storm itself but on the preparation beforehand. Noah’s obedience secured refuge for him and his family long before the first drop fell. The KJV’s direct wording reinforces God’s reliability—His warnings are not empty. For me, this verse is a call to take God seriously in advance, to walk in obedience before the trial begins, and to endure within the shelter He provides.","I need to stay faithful in building when skies are still clear. Trust means preparing today for storms that haven’t yet started. God’s word is my ark, and His presence is my refuge when judgment falls.","Dear Heavenly Father, Refuge of my soul, thank You for being my shelter in every storm. Keep me faithful in preparation and steadfast in endurance until Your promises bring me through. I pray this in the name of Jesus Christ, Amen."
7,Genesis 9:2,"And the fear of you and the dread of you shall be upon every beast of the earth, and upon every fowl of the air, upon all that moveth upon the earth, and upon all the fishes of the sea; into your hand are they delivered.","Stewardship, Authority, Fear","After the flood, creation fears humanity. Authority is given, but it must be stewarded with care, not exploitation. Dominion is responsibility under God.","Genesis 9:2 declares: “And the fear of you and the dread of you shall be upon every beast of the earth…” This marks a shift in creation’s relationship with mankind. Fear becomes the new response to human authority. In the KJV, the words “fear” and “dread” emphasize both weight and warning—authority can bless or abuse. For me, this verse highlights that dominion is not license to dominate, but a sacred trust to rule as God rules—with protection, care, and alignment with His heart. Authority without stewardship breeds dread; authority under God reflects His goodness.","I must view influence, resources, and leadership as stewardship, not ownership. My choices affect not just people but all creation. Aligning my authority with God means leading with humility and care.","Dear Heavenly Father, King Jesus, my Shepherd and Lord, teach me true stewardship. May my authority reflect Your kindness and care, so that everything under my influence finds blessing, not fear. I pray this in the name of Jesus Christ, Amen."
8,Genesis 10:8,And Cush begat Nimrod: he began to be a mighty one in the earth.,"Ambition, Fame, Motives",Nimrod became known as a mighty one in the earth. Strength and reputation apart from God’s will turn into monuments of pride.,"Genesis 10:8 records: “And Cush begat Nimrod: he began to be a mighty one in the earth.” The KJV presents Nimrod as the first figure of renown after the flood, but his might is not tied to righteousness. His ambition later fuels rebellion and the building of Babel. The verse shows that human greatness apart from God easily bends toward self-glory. For me, it warns that my motives matter as much as my accomplishments. Ambition can build towers to self or altars to God, depending on who I exalt.","I must examine the heart behind my work. Am I seeking to make a name for myself, or to honor the Lord? True greatness is surrender, not self-promotion.","Dear Heavenly Father, search my motives and redirect my ambition into worship. Make my strength a tool for Your glory, not my reputation. I pray this in the name of Jesus Christ, Amen."
9,Genesis 11:24,"And Nahor lived nine and twenty years, and begat Terah:","Lineage, Timing, Hiddenness","In the genealogy, Nahor is born to Serug. Even in ordinary names, God is weaving extraordinary promises.","Genesis 11:24 says: “And Nahor lived nine and twenty years, and begat Terah.” On the surface, it is just another name in a genealogy, but in context, Terah becomes the father of Abram. The KJV’s straightforward cadence reminds me that God’s story unfolds through quiet, hidden generations. Faith is not only in the dramatic but in the daily passing of life, where names and years slowly build toward God’s promises. For me, this is encouragement that even when my season feels unnoticed, God is threading His purposes through the ordinary.","I need to trust that my hidden seasons are not wasted. God’s timing includes days, years, and generations. My role is to live faithfully now, believing He is aligning my story with His larger plan.","Dear Heavenly Father, Faithful Father of generations, thank You for working through hidden seasons. Write Your promise through my ordinary days and let me rest in Your perfect timing. I pray this in the name of Jesus Christ, Amen."
10,Genesis 13:8,"And Abram said unto Lot, Let there be no strife, I pray thee, between me and thee, and between my herdmen and thy herdmen; for we be brethren.","Peacemaking, Generosity, Trust","Abram sought peace with Lot, choosing unity over conflict. Trust in God freed him to let go of personal advantage.","Genesis 13:8 says: “And Abram said unto Lot, Let there be no strife, I pray thee, between me and thee, and between my herdmen and thy herdmen; for we be brethren.” The KJV highlights Abram’s appeal with humility and kinship. Rather than fight for territory, Abram sought peace, showing faith that God would provide regardless of Lot’s choice. This verse challenges me to value relationships over resources and to trust God’s provision more than human negotiation. Peacemaking often means releasing rights, but it opens the way for God’s greater blessing.","I must be willing to choose peace over pride. Even when I feel entitled, surrendering to God’s care allows Him to direct the outcome. Unity with others is a greater testimony than winning an argument.","Dear Heavenly Father, God of peace, help me release my grasp on control. Teach me to choose generosity and trust Your provision above my own striving. I pray this in the name of Jesus Christ, Amen."
11,Genesis 14:23,"That I will not take from a thread even to a shoelatchet, and that I will not take any thing that is thine, lest thou shouldest say, I have made Abram rich:","Integrity, Dependence, Provision",Abram refused even a thread or shoelace from the king of Sodom so no one could claim credit for God’s blessing. Integrity protects testimony.,"Genesis 14:23 says: “That I will not take from a thread even to a shoelatchet, and that I will not take any thing that is thine, lest thou shouldest say, I have made Abram rich.” Abram understood that compromise with Sodom’s king could taint God’s glory. By refusing reward, he declared that God alone would provide for him. The KJV’s phrasing emphasizes even the smallest item — a thread, a shoelace — showing that Abram’s dependence on God was total. For me, this verse is a call to guard my integrity and resist partnerships that could weaken my witness.","I must refuse to accept provision or advancement that compromises my dependence on God. When I live with integrity, others see that what I have comes from Him alone.","Dear Heavenly Father, my Provider, guard my heart from compromise. Let my life testify clearly that every blessing comes from You and You alone. I pray this in the name of Jesus Christ, Amen."
12,Genesis 16:11,"And the angel of the LORD said unto her, Behold, thou art with child, and shalt bear a son, and shalt call his name Ishmael; because the LORD hath heard thy affliction.","God Who Hears, Comfort, Naming","Hagar, abandoned and afflicted, hears the angel declare that God has listened to her misery. The God of heaven bends to the cries of the rejected.","Genesis 16:11 reveals a God who not only sees but also hears. Hagar, on the margins and carrying sorrow, receives a promise directly from God. Her son’s name, Ishmael (“God hears”), is a living testimony that suffering is not wasted. This reminds me that even when I feel unseen by others, heaven is tuned to my cry. God dignifies the brokenhearted by weaving their pain into His purposes.","God’s response to Hagar shows that pain is not wasted. Even in exile, His ear is open, and He names the future with hope. My suffering is not the end of the story—it becomes the soil where God’s promises grow.","Dear Heavenly Father, thank You for being the God who hears my cries. In my affliction, remind me that my pain is never ignored. Speak hope into my wilderness and give me faith to keep walking. I ask this in Jesus’ name, Amen."
13,Genesis 18:4,"Let a little water, I pray you, be fetched, and wash your feet, and rest yourselves under the tree:","Hospitality, Presence, Service","Abraham welcomed three visitors with simple acts of hospitality, unaware he was entertaining the Lord. Small acts of service open the door to divine encounters.","Genesis 18:4 shows Abraham offering water for weary travelers’ feet, an ordinary kindness that became the setting for extraordinary promise. God often moves in the midst of simple, faithful service. What seems routine—welcoming strangers, providing refreshment—can become sacred space where heaven touches earth. This challenges me to treat even the smallest opportunities to serve as moments where Christ may be present.","Hospitality is not small to God. Simple acts of care can become a doorway to divine encounters. I want to live watchful, ready to see God in ordinary service.","Dear Heavenly Father, open my eyes to see You in ordinary guests and everyday moments. Help me offer hospitality that honors Your presence. I ask this in Jesus’ name, Amen."
14,Genesis 19:2,"And he said, Behold now, my lords, turn in, I pray you, into your servant’s house, and tarry all night, and wash your feet, and ye shall rise up early, and go on your ways. And they said, Nay; but we will abide in the street all night.","Protection, Discernment, Courage","Lot urged the angelic visitors to stay in his house, shielding them from danger in Sodom. Righteousness often requires costly courage to protect the vulnerable.","Genesis 19:2 shows Lot insisting that his guests come under his roof despite the risk. This act of protection, though inconvenient, reflected discernment in recognizing their value and the evil outside. Righteousness is not passive—it takes bold steps to defend what is holy and vulnerable. This challenges me to protect others even when it comes at personal cost.","Hospitality is not small to God. Simple acts of care can become a doorway to divine encounters. I want to live watchful, ready to see God in ordinary service.","Dear Heavenly Father, give me discernment and courage to protect others, even when it is costly. Let my actions reflect Your heart of righteousness. I ask this in Jesus’ name, Amen."
15,Genesis 19:33,"And they made their father drink wine that night: and the firstborn went in, and lay with her father; and he perceived not when she lay down, nor when she arose.","Boundaries, Fallout, Mercy","Lot’s daughters acted out of fear and despair, leading to tragic consequences. This passage warns me how brokenness multiplies when boundaries are lost.","Genesis 19:33 captures a painful moment where grief and hopelessness led to compromise. Intoxication blurred judgment, and sin entered a family line. Yet even through this brokenness, God’s mercy still worked out His purposes. The lesson for me is clear: despair and lack of boundaries can distort choices, but God’s mercy is greater than generational failure.","This verse warns me that despair distorts judgment. Without boundaries, brokenness multiplies. Yet even in family fallout, God’s mercy writes redemption.","Dear Heavenly Father, protect me from compromise born of despair. Heal the brokenness in family lines and turn fallout into a testimony of mercy. I ask this in Jesus’ name, Amen."
16,Genesis 21:9,"And Sarah saw the son of Hagar the Egyptian, which she had born unto Abraham, mocking.","Joy, Fulfillment, Laughter",Sarah laughed with joy when God fulfilled His promise. What once brought doubt became a testimony of His faithfulness.,"Genesis 21:6 shows the transforming power of God’s timing. Sarah, once skeptical and barren, now laughs with delight because the impossible became reality. God turns ridicule into joy, proving that His promises never fail. This verse reminds me that God can reverse hopelessness and make even my deepest wounds into reasons for rejoicing.","God transforms ridicule into joy. Sarah’s laughter is proof that His timing cannot fail. I want to carry that same hope, trusting that impossible places in my life will one day resound with joy.","Dear Heavenly Father, thank You for turning sorrow into joy and fulfilling promises in Your perfect time. Help me to wait with faith and celebrate Your goodness. I ask this in Jesus’ name, Amen."
17,Genesis 22:9,"And they came to the place which God had told him of; and Abraham built an altar there, and laid the wood in order, and bound Isaac his son, and laid him on the altar upon the wood.","Faith, Provision, Sacrifice",Abraham declared that God Himself would provide the lamb. Faith speaks provision even before it is seen.,"Genesis 22:8 captures Abraham’s trust in the face of unimaginable sacrifice. When Isaac questioned the missing lamb, Abraham responded with faith, not fear: “God will provide.” This moment foreshadows Christ, the true Lamb. It also challenges me to speak words of faith when circumstances appear lacking. God’s provision may not look early, but it will never be late.","God transforms ridicule into joy. Sarah’s laughter is proof that His timing cannot fail. I want to carry that same hope, trusting that impossible places in my life will one day resound with joy.","Dear Heavenly Father, increase my faith to obey You fully and trust that You will provide at the right time. Thank You for the Lamb of God, Jesus Christ, who takes away my sin. I ask this in Jesus’ name, Amen."
18,Genesis 24:1,"And Abraham was old, and well stricken in age: and the LORD had blessed Abraham in all things.","Blessing, Fulfillment, Faithfulness","Abraham reached old age, “well advanced in years,” and the Lord had blessed him in everything. A lifetime of faith was met with a testimony of God’s faithfulness.","Genesis 24:1 reminds me that God’s blessings are not just momentary but enduring across a whole life. Abraham had walked through testing, obedience, and promises long delayed. Yet, at the end, the testimony was complete: “the Lord had blessed Abraham in everything.” This verse is a vision of finishing well—remaining faithful through seasons of trial until my life also tells the story of God’s goodness from beginning to end.","This verse calls me to live in a way that at the end of my days, the story isn’t about wealth, position, or reputation, but about God’s faithfulness in every area. Obedience today shapes the testimony tomorrow.","Dear Heavenly Father, help me live faithfully through every season so that my life declares Your blessing and goodness. Teach me to trust Your promises until they are fulfilled. I ask this in Jesus’ name, Amen."
